0	reveal a secret	1
0	risked her life	1
0	risked breaking his neck	1
0	ideas simmering in the back of my mind	2
0	the vanes of a windmill	2
0	well schooled in languages	2
0	The child was schooled at great cost to her family.	4
0	rugged mountains	1
0	… misidentified as … a flying reptile, not a feathered dinosaur …	10
0	He was a big man, and in his costume— … feathered anklets, feathered gauntlets, beaded headband … —he seemed magnified in every dimension, almost a spirit-being.	11
0	referring to birds as "our feathered friends"	6
0	coil a rope	1
0	coiled herself up on the couch	1
0	the sun blazed overhead	3
0	fields blazing with flowers	2
0	a decorative motif	3
0	Ms. Cisneros doesn't present too many nice guys here, and the perfidy of men is a motif in several of the stories.	17
0	"How queer it seems," Alice said to herself, "to be going messages for a rabbit!"	2
0	The endless and numberless avenues of bewildering pine woods gave him a queer feeling that he was driving through the countless corridors of a dream.	13
0	scan poetry	1
0	Teachers are negotiating for higher salaries.	3
0	dip candles	1
0	dancing to our favorite song	1
0	dance for joy	1
0	Shall we dance?	3
0	suppress a riot	1
0	apprehend a thief	1
0	She immediately apprehended the problem.	3
0	overexcited children	1
0	an overexcited imagination	2
0	overexcited neurons	1
0	a grizzled beard	2
0	a grizzled veteran	2
0	wrote a hilarious parody of a popular song	4
0	a cheesy parody of a classic western	3
0	wrote a hilarious parody of a popular song	4
0	a cheesy parody of a classic western	3
0	Their hair was sleek, of a slightly other period, immaculate pageboys and French twists.	11
0	a mirror reflects light	3
0	the clouds were reflected in the water	4
0	a veiled hat	2
0	veiled threats	1
0	the seventeenth century lay in the penumbra of the middle ages	7
0	foxy grapes	1
0	Group identity in oppressed groups is always very strategic, always a calculation of advantage.	4
0	They are neither oppressed minorities, whose needs have been etched into the nation's consciousness, nor members of the ruling elite, born with their hands on the reins of power.	4
0	shut the lid	1
0	shut herself in her study	1
0	hit by an avalanche of paperwork	4
0	somber dignitaries	1
0	She aims to win.	2
0	Aim carefully before shooting.	1
0	Darting down the corridor …, she reappeared moments later carrying glasses in filigreed silver holders …	7
0	By year's end the insects have gone, only to reappear briefly in May.	10
0	variegated leaves	1
0	a brave soldier	2
0	brave banners flying in the wind	1
0	a brave smile	2
0	Storm clouds loomed on the horizon.	3
0	deficits loomed large	2
0	spoke in low tones	4
0	masculine tones	2
0	pabulum for consideration and reflection	1
0	Roots deliver pabulum to the plant.	3
0	a howling storm	2
0	a howling wilderness	2
0	swap stories	1
0	it is cold outside today	3
0	a cold stare	2
0	a cold drafty attic	2
0	the music was a turnoff	5
0	hop in the car	1
0	horny-handed	1
0	a horny growth	2
0	protesters were chanting outside	3
0	What is there to cheer about?	5
0	extract data	1
0	designed to be a forgiving tennis racquet	5
0	spokes attached to the hub of the wheel	5
0	The island is a major tourist hub.	7
0	stale bread	1
0	a stale routine	2
0	a tart apple	2
0	a tart rejoinder	2
0	wade through the crowd	1
0	The jury absolved the defendants of their crimes.	3
0	asked the priest to absolve his sins	5
0	Her youth does not absolve her of responsibility for her actions.	5
0	The pills made her drowsy.	5
0	a drowsy village	2
0	a creamy consistency	2
0	cut costs to the bone	5
0	Give Me Liberty, the Milwaukee-made movie that received good notices at this year's Sundance Film Festival and the Cannes Film Festival, will come home for its U.S. theatrical premiere, Aug. 22 at the Oriental Theatre.	28
0	a theatrical costume	2
0	a theatrical gesture	2
0	a powerful theatrical performance	3
0	a theatrical troupe	2
0	an actor with a flair for melodrama	7
0	The trial turned into a melodrama.	6
0	fumes leak in	2
0	confidential information leaked out	3
0	his stomach growled	3
0	a blossoming talent	2
0	They were doubtful about the advantages of the new system.	3
0	of doubtful repute	2
0	a vegetable plot	3
0	would not disclose his salary	3
0	… a new initiative targeting brothels and massage parlors fronting for sex trafficking rings.	10
0	a ten-acre plot fronting on a lake	4
0	irritated eyes	1
0	doesn't recall dreaming last night	3
0	dreaming of a better future	1
0	dream of departed loved ones	1
0	hidden among the trees	2
0	living among artists	2
0	tie a fishing fly	1
0	tie a fishing fly	1
0	clear the water by filtering	1
0	the opportunity to clear himself	4
0	reopen discussion	1
0	a glamorous actress	2
0	a glamorous life	2
0	doesn't recall dreaming last night	3
0	dreaming of a better future	1
0	dream of departed loved ones	1
0	cram a suitcase with clothes	1
0	a novel crammed with surprises	3
0	a dog chasing a rabbit	3
0	sort apples	1
0	sort mail	1
0	a boiling sea	2
0	the flight of a bee	2
0	flight of an arrow	1
0	swing an ax	1
0	the heat dampened our spirits	3
0	the shower barely dampened the ground	4
0	the legs of a tripod	2
0	positioned the chairs around the room	1
0	positioned the company in the global market	1
0	drive cattle across the prairie	1
0	drives a hard bargain	1
0	Americans cringed … at the use of a term now regarded as a slur	2
0	The terrified animal cringed in the corner.	4
0	Americans cringed … at the use of a term now regarded as a slur	2
0	The terrified animal cringed in the corner.	4
0	The addition expanded the kitchen.	2
0	The clerk was a recent addition to the staff.	6
0	adds 60 acres to his land	1
0	Do you have anything else to add to the discussion?	7
0	wine adds a creative touch to cooking	2
0	the healing miracles described in the Gospels	3
0	The bridge is a miracle of engineering.	5
0	These jeans don't fit me anymore.	4
0	My first impression of Joy was that her name fit her perfectly. She radiated joy and calmness …	10
0	the fox trotted over the knoll	3
0	Let's face it: The process of waiting for your hair to loc can be both lengthy and frustrating.	12
0	Chris Gilliam, 37, a 14-year veteran of the Dallas Police Department who began wearing locks last fall, was drawn to the style's symbolism. "If left to its own devices, our hair will lock. People, left to our own devices, maybe we will come together too," he says.	33
0	You can choose to let the hair loc and then separate it. But you can also part the hair in advance to divide it into distinct sections.	8
0	holds a PhD	1
0	holds a PhD	1
0	holds property worth millions	1
0	the bank holds the title to the car	3
0	the corruption of computer files	2
0	the corruption of computer files	2
0	media bashing	2
0	a proposal that smacks of treason	4
0	an economy crippled by inflation	3
0	a fabulous view from the summit	2
0	fabulous wealth	1
0	fabulous dragons	1
